{
  "sourceId": "jre-point-campaigns",
  "sourceUrl": "https://www.jrepoint.jp/campaign/list/",
  "fetchedAt": "2026-09-13T22:56:47.487Z",
  "promptVersion": "campaign-vUnknown",
  "extractor": "campaign",
  "geminiModel": "gemini-2.5-flash",
  "notes": "[crawl:index] index=https://www.jrepoint.jp/campaign/list/ 子ページ 5 件 (成功 0 / 失敗 5)\n✗ https://www.jrepoint.jp/campaign/0000003050/ (年3回！JR東日本新幹線全線が35％OFFの特別レートで交換可能！) → allUrlsFailed\n✗ https://www.jrepoint.jp/campaign/0000003038/ (水曜日はエキナカSuicaの日) → allUrlsFailed\n✗ https://www.jrepoint.jp/campaign/0000003043/ (タッチでエキナカ 入場券ポイントバック！) → allUrlsFailed\n✗ https://www.jrepoint.jp/campaign/0000003061/ (【グランデュオ蒲田】ステップアッププログラムポイントアップデーのお知らせ) → allUrlsFailed\n✗ https://www.jrepoint.jp/campaign/0000003062/ (【グランデュオ立川】ステップアッププログラムポイントアップデーのお知らせ) → allUrlsFailed\nindex notes: 重複リンクはそのまま列挙し、抽選系キャンペーンも指示に従い抽出しました。"
}