{
  "sourceId": "orico-card-member-point",
  "sourceUrl": "https://www.orico.co.jp/creditcard/list/thepoint/",
  "fetchedAt": "2026-09-23T23:32:19.084Z",
  "promptVersion": "card-v1.1",
  "extractor": "card",
  "geminiModel": "gemini-2.5-flash",
  "notes": "Orico Card THE POINTの基本還元率と、オリコモール利用時の追加還元率を抽出。入会後6ヶ月間の還元率2.0%アップは、ユーザーごとの入会時期に依存するため、rulesには含めずnotesで言及する。",
  "cards": [
    {
      "cardId": "orico-the-point",
      "defaultRate": 0.01,
      "defaultCurrencyId": "orico-pt",
      "evidenceQuote": "還元率は常に1.0％以上！100円で1オリコポイントがたまる！",
      "explicitness": 1,
      "ambiguity": 0
    }
  ],
  "storeRules": [],
  "categoryRules": [
    {
      "cardId": "orico-the-point",
      "category": "ネット通販",
      "rate": 0.02,
      "currencyId": "orico-pt",
      "evidenceQuote": "オリコモールのご利用でさらに0.5％のオリコポイントを特別加算！ オリコモールを経由しネットショッピングした場合、カードご利用分（1.0％）+オリコモールご利用分（+0.5%以上）+特別加算（0.5％）で2%以上のオリコポイントがたまります。",
      "explicitness": 0.9,
      "ambiguity": 0.1
    }
  ]
}