{
  "sourceId": "smbc-v-gold-7percent",
  "sourceUrl": "https://www.smbc-card.com/mem/cardinfo/cardinfo9001629.jsp",
  "fetchedAt": "2026-09-13T22:52:19.591Z",
  "promptVersion": "card-vUnknown",
  "extractor": "card",
  "geminiModel": "gemini-2.5-flash",
  "notes": "Gemini could not extract structured data from this URL. Likely cause: page is a navigation hub, not the partner list itself. Raw response (first 300 chars):  The page is about \"対象のコンビニ・飲食店で最大8％還元！\" (Max 8%還元 at対象のコンビニ・飲食店). The `cardId` is `smbc-v-gold-7percent`. This suggests the default rate for this specific card in the featured program is 7%. Let's break down the information: **1. Default Rate for `smbc-v-gold-7percent` (三井住友カード ゴールド VISA/ Master"
}