{
  "sourceId": "jal-card-tokuyaku-list",
  "sourceUrl": "https://partner.jal.co.jp/search_result/?ptn=1&ct=2&scat=1201",
  "fetchedAt": "2026-09-23T23:25:16.264Z",
  "promptVersion": "jal-tokuyaku-v1.1",
  "extractor": "jal-tokuyaku",
  "geminiModel": "gemini-2.5-flash",
  "notes": "指定されたURLは「レストラン・予約サイト」の検索結果であり、全国/広域チェーン店に該当する店舗が確認できませんでした。表示されている店舗はすべて地域密着型の飲食店や個人店と判断したため、stores[]には抽出していません。",
  "categoryRules": [
    {
      "cardId": "jal-suica",
      "category": "JAL特約店",
      "rate": 0.02,
      "currencyId": "jal-mile",
      "evidenceQuote": "JALカードでの決済でショッピングマイルが2倍たまる（JALカード特約店）",
      "explicitness": 0.95,
      "ambiguity": 0.05
    }
  ]
}