{
  "sourceId": "paypay-campaigns",
  "sourceUrl": "https://paypay.ne.jp/event/",
  "fetchedAt": "2026-10-21T23:54:17.499Z",
  "promptVersion": "campaign-v3.5",
  "extractor": "campaign",
  "geminiModel": "gemini-2.5-flash",
  "programs": [],
  "memberships": [],
  "stores": [],
  "notes": "「最大○○還元」「抽選」「対象者限定」などの条件が付くキャンペーンが多く、確実な還元率と期間が明記された店舗対象キャンペーンが見つかりませんでした。"
}