{
  "sourceId": "mufg-card-global-point",
  "sourceUrl": "https://www.cr.mufg.jp/member/rule/mufgcard/globalpoint.html",
  "fetchedAt": "2026-09-16T23:35:24.451Z",
  "promptVersion": "card-v1.1",
  "extractor": "card",
  "geminiModel": "gemini-2.5-flash",
  "notes": "このページはグローバルポイント利用規程であり、一般的な還元率とポイントプログラムの詳細を説明しています。個別の店舗やカテゴリでの優遇還元率は記載されていません。",
  "cards": [
    {
      "cardId": "mufg-card-global-point",
      "defaultRate": 0.001,
      "defaultCurrencyId": "mufg-pt",
      "evidenceQuote": "1千円につき1ポイントを約定支払日に本会員に付与します。",
      "evidenceUrl": "https://www.cr.mufg.jp/member/rule/mufgcard/globalpoint.html",
      "explicitness": 1,
      "ambiguity": 0
    }
  ]
}